ANO_LETIVO;NM_DIRETORIA;NM_MUNICIPIO;CD_REDE_ENSINO;CD_ESCOLA;NM_COMPLETO_ESCOLA;CD_TP_IDENTIFICADOR;APR_1;REP_1;ABA_1;APR_2;REP_2;ABA_2;APR_3;REP_3;ABA_3
2021;SAO BERNARDO DO CAMPO;SAO BERNARDO DO CAMPO;1;448400;CENTRO ATEND SOCIO-EDUC AO ADOLESCENTE S B DO CAMPO I CI;34;100;0;0;100;0;0;100;0;0
2021;SAO BERNARDO DO CAMPO;SAO BERNARDO DO CAMPO;1;457474;CENTRO ATEND SOCIO EDUC AO ADOLESCENTE SAO B CAMPO II CI;34;0;0;0;100;0;0;100;0;0
2021;SAO BERNARDO DO CAMPO;SAO BERNARDO DO CAMPO;1;902020;LUIS DOS SANTOS METALURGICO;8;0;0;0;100;0;0;100;0;0
2021;SAO BERNARDO DO CAMPO;SAO BERNARDO DO CAMPO;1;904958;FRANCISCO CRISTIANO LIMA DE FREITAS;8;0;0;0;99,75;0,25;0;100;0;0
2021;SAO BERNARDO DO CAMPO;SAO BERNARDO DO CAMPO;1;904971;MARISTELA VIEIRA PROFESSORA;8;0;0;0;99,36;0,64;0;97,69;2,31;0
2021;SAO BERNARDO DO CAMPO;SAO BERNARDO DO CAMPO;1;906669;WALKER DA COSTA BARBOSA PROFESSOR;8;0;0;0;99,87;0,13;0;100;0;0
2021;SAO BERNARDO DO CAMPO;SAO BERNARDO DO CAMPO;1;906670;YVONE FRUTUOSO PRODOSSIMO PROFESSORA;8;0;0;0;96,58;3,42;0;0;0;0
2021;SAO BERNARDO DO CAMPO;SAO BERNARDO DO CAMPO;1;907182;MARIO FRANCISCON;8;0;0;0;99,12;0,88;0;93,24;6,76;0
2021;SAO BERNARDO DO CAMPO;SAO BERNARDO DO CAMPO;1;908745;NEUSA FIGUEIREDO MARCAL PROFESSORA;8;0;0;0;100;0;0;100;0;0
2021;SAO BERNARDO DO CAMPO;SAO BERNARDO DO CAMPO;1;908757;MARIA AUXILIADORA MARQUES PROFESSORA;8;0;0;0;100;0;0;100;0;0
2021;SAO BERNARDO DO CAMPO;SAO BERNARDO DO CAMPO;1;908769;VILMA APPARECIDA ANSELMO SILVEIRA PROFESSORA;8;0;0;0;90,67;9,33;0;86,25;13,75;0
2021;SAO BERNARDO DO CAMPO;SAO BERNARDO DO CAMPO;1;910764;CLARICE DE MAGALHAES CASTRO PROFESSORA;8;0;0;0;100;0;0;100;0;0
2021;SAO BERNARDO DO CAMPO;SAO BERNARDO DO CAMPO;1;913807;OMAR DAIBERT REVERENDO;8;0;0;0;100;0;0;100;0;0
2021;SAO BERNARDO DO CAMPO;SAO BERNARDO DO CAMPO;1;915750;CELIO LUIZ NEGRINI PROFESSOR;8;0;0;0;99,53;0,24;0,23;90,24;9,76;0
2021;SAO BERNARDO DO CAMPO;SAO BERNARDO DO CAMPO;1;917515;MARIA REGINA DEMARCHI FANANI;8;0;0;0;100;0;0;100;0;0
2021;SAO BERNARDO DO CAMPO;SAO BERNARDO DO CAMPO;1;921105;AYRTON SENNA DA SILVA;8;0;0;0;100;0;0;96,79;2,56;0,65
2021;SAO BERNARDO DO CAMPO;SAO BERNARDO DO CAMPO;1;921543;NELSON MONTEIRO PALMA PROFESSOR;8;0;0;0;99,9;0;0,1;99,88;0,12;0
2021;SAO BERNARDO DO CAMPO;SAO BERNARDO DO CAMPO;1;922924;MARCO ANTONIO PRUDENTE DE TOLEDO PROFESSOR;8;0;0;0;100;0;0;0;0;0
2021;SAO BERNARDO DO CAMPO;SAO BERNARDO DO CAMPO;1;923904;SERGIO VIEIRA DE MELLO DIPLOMATA;8;0;0;0;100;0;0;100;0;0
2021;SAO BERNARDO DO CAMPO;SAO BERNARDO DO CAMPO;1;924210;TEREZA DELTA;8;0;0;0;100;0;0;0;0;0
2021;SAO BERNARDO DO CAMPO;SAO BERNARDO DO CAMPO;1;924428;MAURICIO DE CASTRO;8;0;0;0;94,68;4,15;1,17;83,99;13,72;2,29
2021;SAO BERNARDO DO CAMPO;SAO CAETANO DO SUL;1;9350;MARIA TRUJILO TORLONI;8;0;0;0;100;0;0;100;0;0
2021;SAO BERNARDO DO CAMPO;SAO CAETANO DO SUL;1;9404;JOANA MOTTA PROFESSORA;8;0;0;0;98,87;1,13;0;100;0;0
2021;SAO BERNARDO DO CAMPO;SAO CAETANO DO SUL;1;9416;LAURA LOPES;8;0;0;0;100;0;0;100;0;0
2021;SAO BERNARDO DO CAMPO;SAO CAETANO DO SUL;1;9436;EDGAR ALVES DA CUNHA PROFESSOR;8;0;0;0;100;0;0;100;0;0
2021;SAO BERNARDO DO CAMPO;SAO CAETANO DO SUL;1;9441;ALFREDO BURKART PROFESSOR;8;0;0;0;97,34;2,66;0;97,72;2,28;0
2021;SAO BERNARDO DO CAMPO;SAO CAETANO DO SUL;1;9453;ALEXANDRE GRIGOLLI PADRE;8;0;0;0;100;0;0;99,02;0;0,98
2021;SAO BERNARDO DO CAMPO;SAO CAETANO DO SUL;1;9465;YOLANDA ASCENCIO PROFESSORA;8;0;0;0;100;0;0;100;0;0
2021;SAO BERNARDO DO CAMPO;SAO CAETANO DO SUL;1;9477;MARIA DA CONCEICAO MOURA BRANCO PROFESSORA;8;0;0;0;99,42;0,58;0;91,03;8,97;0
2021;SAO BERNARDO DO CAMPO;SAO CAETANO DO SUL;1;9573;BONIFACIO DE CARVALHO CORONEL;8;0;0;0;0;0;0;91,82;7,95;0,23
2021;SAO BERNARDO DO CAMPO;SAO CAETANO DO SUL;1;9581;IDALINA MACEDO COSTA SODRE DONA;8;0;0;0;100;0;0;100;0;0
2021;CARAPICUIBA;CARAPICUIBA;1;4191;CIDADE ARISTON ESTELA AZEVEDO VI;8;0;0;0;96,22;3,78;0;93,35;6,65;0
2021;CARAPICUIBA;CARAPICUIBA;1;9635;MARIA ALICE CRISSIUMA MESQUITA DONA;8;99,86;0,14;0;100;0;0;0;0;0
2021;CARAPICUIBA;CARAPICUIBA;1;9647;FLORA STELLA PROFESSORA;8;99,2;0;0,8;0;0;0;0;0;0
2021;CARAPICUIBA;CARAPICUIBA;1;9659;BENEDITO DE LIMA TUCUNDUVA DOUTOR;8;0;0;0;100;0;0;100;0;0
2021;CARAPICUIBA;CARAPICUIBA;1;9660;ESMERALDA BECKER FREIRE DE CARVALHO PROFESSORA;8;99,69;0,31;0;100;0;0;100;0;0
2021;CARAPICUIBA;CARAPICUIBA;1;9672;JOSUE MATTOS DE AGUIAR;8;100;0;0;100;0;0;0;0;0
2021;CARAPICUIBA;CARAPICUIBA;1;9684;MARISE DA COSTA CORREA DE OLIVEIRA PROFESSORA;8;100;0;0;0;0;0;0;0;0
2021;CARAPICUIBA;CARAPICUIBA;1;9696;ALBERTO KENWORTHY;8;100;0;0;100;0;0;0;0;0
2021;CARAPICUIBA;CARAPICUIBA;1;9702;OSVALDO ELCI PROFESSOR;8;100;0;0;0;0;0;0;0;0
2021;CARAPICUIBA;CARAPICUIBA;1;9714;RICARDINA CAMPELLO FONSECA RODRIGUES;8;100;0;0;0;0;0;0;0;0
2021;CARAPICUIBA;CARAPICUIBA;1;9726;MARIO SALES SOUTO ENGENHEIRO;8;98,74;0,18;1,08;100;0;0;0;0;0
2021;CARAPICUIBA;CARAPICUIBA;1;9738;HADLA FERES PROFESSORA;8;0;0;0;99,79;0,21;0;99,32;0,68;0
2021;CARAPICUIBA;CARAPICUIBA;1;9748;IGNEZ DOS SANTOS SILVA;8;100;0;0;0;0;0;0;0;0
2021;CARAPICUIBA;CARAPICUIBA;1;9751;TOUFIC JOULIAN;8;0;0;0;99,4;0,6;0;96,54;3,46;0
2021;CARAPICUIBA;CARAPICUIBA;1;9763;AMOS MEUCCI;8;0;0;0;96,58;3,42;0;92,44;7,56;0
2021;CARAPICUIBA;CARAPICUIBA;1;9817;VICTORIO FORNASARO;8;100;0;0;100;0;0;98;0,5;1,5
2021;CARAPICUIBA;CARAPICUIBA;1;9842;DIVA DA CUNHA BARRA PROFESSORA;8;0;0;0;0;0;0;99,63;0,37;0
2021;CARAPICUIBA;CARAPICUIBA;1;9854;WILLIAN RODRIGUES REBUA PROFESSOR;8;0;0;0;0;0;0;100;0;0
2021;CARAPICUIBA;CARAPICUIBA;1;9885;EDGARD DE MOURA BITTENCOURT DESEMBARGADOR;8;0;0;0;98,4;1,14;0,46;0;0;0
2021;CARAPICUIBA;CARAPICUIBA;1;35439;MANOEL DA CONCEICAO SANTOS PROFESSOR;8;0;0;0;100;0;0;100;0;0
2021;CARAPICUIBA;CARAPICUIBA;1;35452;CECILIA DA PALMA VALENTIM SARDINHA PROFESSORA;8;100;0;0;95,99;3,82;0,19;94,75;5,25;0
2021;CARAPICUIBA;CARAPICUIBA;1;35464;FRANCISCO RIBEIRO ROSA PROFESSOR;8;100;0;0;0;0;0;0;0;0
2021;CARAPICUIBA;CARAPICUIBA;1;35476;CELSO PACHECO BENTIN PROFESSOR;8;99,7;0,3;0;0;0;0;0;0;0
2021;CARAPICUIBA;CARAPICUIBA;1;36377;REGINA HALEPIAN ANTUNES PROFESSORA;8;94,3;5,7;0;0;0;0;0;0;0
2021;CARAPICUIBA;CARAPICUIBA;1;38532;DIDITA CARDOSO ALVES PROFESSORA;8;100;0;0;0;0;0;0;0;0
2021;CARAPICUIBA;CARAPICUIBA;1;38544;SALOMAO JORGE DEPUTADO;8;0;0;0;97,95;2,05;0;96,01;3,99;0
2021;CARAPICUIBA;CARAPICUIBA;1;38556;RICARDO ANTONIO PECCHIO PROFESSOR;8;94,05;4,53;1,42;0;0;0;0;0;0
2021;CARAPICUIBA;CARAPICUIBA;1;38568;ODETTE ALGODOAL LANZARA PROFESSORA;8;100;0;0;100;0;0;0;0;0
2021;CARAPICUIBA;CARAPICUIBA;1;40587;LUIZ PEREIRA SOBRINHO PROFESSOR;8;100;0;0;100;0;0;100;0;0
2021;CARAPICUIBA;CARAPICUIBA;1;40599;JOSE BENICIO DOS SANTOS;8;98,99;0;1,01;96,61;0;3,39;0;0;0
2021;CARAPICUIBA;CARAPICUIBA;1;40605;JORGE JULIAN;8;0;0;0;100;0;0;0;0;0
2021;CARAPICUIBA;CARAPICUIBA;1;40617;DERVILLE ALLEGRETTI DEPUTADO;8;0;0;0;95,66;4,01;0,33;86,9;11,85;1,25
2021;CARAPICUIBA;CARAPICUIBA;1;40629;MARIA MARQUES DE NORONHA PROFESSORA;8;100;0;0;0;0;0;0;0;0
2021;CARAPICUIBA;CARAPICUIBA;1;41324;NIDELSE MARTINS DE ALMEIDA PROFESSORA;8;99,54;0,09;0,37;0;0;0;0;0;0
2021;CARAPICUIBA;CARAPICUIBA;1;41336;JOAO GARCIA DE HARO PROFESSOR;8;100;0;0;93,49;5,58;0,93;96,18;0;3,82
2021;CARAPICUIBA;CARAPICUIBA;1;41348;BASILIO BOSNIAC;8;99,37;0,63;0;99,14;0,86;0;99,53;0,47;0
2021;CARAPICUIBA;CARAPICUIBA;1;46528;CELESTINO CORREIA PINA PROFESSOR;8;0;0;0;88,34;11,42;0,24;0;0;0
2021;CARAPICUIBA;CARAPICUIBA;1;49037;FABIANA DE QUEIROZ;8;99,16;0,84;0;0;0;0;0;0;0
2021;CARAPICUIBA;CARAPICUIBA;1;49049;ELISABETH SILVA DE ARAUJO PROFESSORA;8;0;0;0;100;0;0;100;0;0
2021;CARAPICUIBA;CARAPICUIBA;1;902093;APARECIDA DE FATIMA SILVA PROFESSORA;8;99,87;0,13;0;0;0;0;0;0;0
2021;CARAPICUIBA;CARAPICUIBA;1;906694;ANA RODRIGUES DE LISO;8;0;0;0;88,89;11,11;0;84,62;15,38;0
2021;CARAPICUIBA;CARAPICUIBA;1;908538;CICERO BARCALA JUNIOR;8;0;0;0;100;0;0;99,78;0,22;0
2021;CARAPICUIBA;CARAPICUIBA;1;908629;PAULO IDEVAR FERRAREZI SUPERVISOR;8;100;0;0;100;0;0;0;0;0
2021;CARAPICUIBA;CARAPICUIBA;1;908630;OLIVEIRA RIBEIRO NETO;8;98,76;1,24;0;0;0;0;0;0;0
2021;CARAPICUIBA;CARAPICUIBA;1;909221;MARIA DE LOURDES TEIXEIRA;8;0;0;0;99,92;0,08;0;100;0;0
2021;CARAPICUIBA;CARAPICUIBA;1;914800;ADALBERTO MECCA SAMPAIO PROFESSOR;8;96,7;1,55;1,75;98,13;1,31;0,56;90,61;7,87;1,52
2021;CARAPICUIBA;CARAPICUIBA;1;914859;ANDREI SAKHAROV;8;99,17;0;0,83;0;0;0;0;0;0
2021;CARAPICUIBA;CARAPICUIBA;1;917035;ZILDA DOMINGOS DE OLIVEIRA;8;97,09;2,91;0;0;0;0;0;0;0
2021;CARAPICUIBA;CARAPICUIBA;1;918829;JOSE MARIA PEREZ FERREIRA PROFESSOR;8;0;0;0;100;0;0;100;0;0
2021;CARAPICUIBA;CARAPICUIBA;1;919068;ANTONIO DE OLIVEIRA GODINHO PADRE;8;100;0;0;100;0;0;99,41;0;0,59
2021;CARAPICUIBA;CARAPICUIBA;1;919093;ALICE MARIA DA SILVA FERREIRA;8;100;0;0;0;0;0;0;0;0
2021;CARAPICUIBA;CARAPICUIBA;1;921427;NATALINO FIDENCIO PROFESSOR;8;0;0;0;98,79;1,21;0;92,87;7,13;0
2021;CARAPICUIBA;CARAPICUIBA;1;923459;ANDRE FRANCO MONTORO GOVERNADOR;8;0;0;0;100;0;0;100;0;0
2021;CARAPICUIBA;CARAPICUIBA;1;923801;VILA DIRCE II;8;98,98;1,02;0;0;0;0;0;0;0
2021;CARAPICUIBA;CARAPICUIBA;1;925470;MARIA HELENA MARDEGAN SCABELLO PROFESSORA;8;0;0;0;83,73;13,92;2,35;80,46;18,21;1,33
2021;CARAPICUIBA;COTIA;1;10492;VINICIUS DE MORAES;8;0;0;0;100;0;0;98,84;0;1,16
2021;CARAPICUIBA;COTIA;1;10509;FERNANDO NOBRE;8;0;0;0;99,58;0;0,42;0;0;0
2021;CARAPICUIBA;COTIA;1;10510;CARLOS FERREIRA DE MORAES PROFESSOR;8;0;0;0;97,45;2,13;0,42;88,72;10,77;0,51
2021;CARAPICUIBA;COTIA;1;10522;ANTONIETA DI LASCIO OZEKI PROFESSORA;8;0;0;0;89,95;5,26;4,79;80,46;12,05;7,49
2021;CARAPICUIBA;COTIA;1;10546;JARDIM SANTA ANGELA;8;96,43;0;3,57;96,9;3,1;0;100;0;0
2021;CARAPICUIBA;COTIA;1;10558;IDOMINEU ANTUNES CALDEIRA;8;0;0;0;95,39;4,61;0;88,21;11,79;0
2021;CARAPICUIBA;COTIA;1;10561;ZACARIAS ANTONIO DA SILVA;8;0;0;0;97,51;2,31;0,18;97,98;2,02;0
2021;CARAPICUIBA;COTIA;1;10571;JOSE BARRETO PROFESSOR;8;0;0;0;97,18;0,47;2,35;90,57;3,77;5,66
2021;CARAPICUIBA;COTIA;1;10583;ODAIR PACHECO PEDROSO PROFESSOR;8;0;0;0;98,55;1,45;0;100;0;0
2021;CARAPICUIBA;COTIA;1;10595;BATISTA CEPELOS;8;0;0;0;99,74;0,26;0;96,15;3,85;0
2021;CARAPICUIBA;COTIA;1;10601;ROQUE CELESTINO PIRES;8;0;0;0;100;0;0;100;0;0
2021;CARAPICUIBA;COTIA;1;10625;ANA MACIEIRA DE OLIVEIRA;8;0;0;0;99,56;0,44;0;98,74;1,26;0
2021;CARAPICUIBA;COTIA;1;35488;PEDRO CASEMIRO LEITE PROFESSOR;8;0;0;0;0;0;0;100;0;0
2021;CARAPICUIBA;COTIA;1;36675;ARY BOUZAN PROFESSOR;8;0;0;0;100;0;0;100;0;0
2021;CARAPICUIBA;COTIA;1;43850;CARLOS DIAS DE SANT ANNA PROFESSOR;8;0;0;0;100;0;0;0;0;0
2021;CARAPICUIBA;COTIA;1;43862;REPUBLICA DA COSTA RICA;8;0;0;0;98,34;0;1,66;98,04;0;1,96
2021;CARAPICUIBA;COTIA;1;44748;ROBERTO CORTE REAL JORNALISTA;8;0;0;0;100;0;0;0;0;0
2021;CARAPICUIBA;COTIA;1;46590;EROTIDES APARECIDA OLIVEIRA DA SILVA PROFESSORA;8;0;0;0;95,31;4,69;0;92,67;7,33;0
2021;CARAPICUIBA;COTIA;1;48112;DAGOBERTO SALLES FILHO DEPUTADO;8;0;0;0;98,69;0,26;1,05;0;0;0
2021;CARAPICUIBA;COTIA;1;48124;REPUBLICA DO PERU;8;0;0;0;97,73;0;2,27;97,76;1,87;0,37
2021;CARAPICUIBA;COTIA;1;48136;KENKITI SIMOMOTO;8;0;0;0;96,11;3,14;0,75;88,64;11,36;0
2021;CARAPICUIBA;COTIA;1;904843;ERNESTO CAETANO DE SOUZA TENENTE;8;0;0;0;95,67;4,33;0;91,53;8,47;0
2021;CARAPICUIBA;COTIA;1;908551;SIDRONIA NUNES PIRES;8;0;0;0;98,1;0;1,9;90,52;2,83;6,65
2021;CARAPICUIBA;COTIA;1;910570;VILA SAO JOAQUIM II;8;0;0;0;93,98;6,02;0;91,81;7,98;0,21
2021;CARAPICUIBA;COTIA;1;910582;CONCEICAO DA COSTA NEVES DEPUTADA;8;0;0;0;97,05;2,72;0,23;0;0;0
2021;CARAPICUIBA;COTIA;1;917011;FERNAO DIAS PAES LEME;8;0;0;0;100;0;0;0;0;0
2021;CARAPICUIBA;COTIA;1;918763;ROQUE SAVIOLI;8;0;0;0;100;0;0;97,98;2,02;0
2021;ITAPECERICA DA SERRA;EMBU-GUACU;1;10273;MARIA ANDRE SCHUNCK DONA;8;0;0;0;100;0;0;100;0;0
2021;ITAPECERICA DA SERRA;EMBU-GUACU;1;10285;PASCHOAL CARLOS MAGNO;8;0;0;0;100;0;0;100;0;0
2021;ITAPECERICA DA SERRA;EMBU-GUACU;1;35403;ALEXANDRE RODRIGUES NOGUEIRA;8;0;0;0;100;0;0;100;0;0
2021;ITAPECERICA DA SERRA;EMBU-GUACU;1;40708;LEONICE DE AQUINO OLIVEIRA;8;0;0;0;100;0;0;100;0;0
2021;ITAPECERICA DA SERRA;EMBU-GUACU;1;44878;OLIVIA DE FARIA NOGUEIRA;8;0;0;0;100;0;0;99,51;0,49;0
2021;ITAPECERICA DA SERRA;EMBU-GUACU;1;46536;HELIO LUIZ DOBROCHINSKI PROF;8;100;0;0;0;0;0;0;0;0
2021;ITAPECERICA DA SERRA;EMBU-GUACU;1;46541;PEDRO VILLAS BOAS DE SOUZA DOM;8;100;0;0;0;0;0;0;0;0
2021;ITAPECERICA DA SERRA;EMBU-GUACU;1;49086;JOAQUIM MENDES FELIZ;8;100;0;0;100;0;0;100;0;0
2021;ITAPECERICA DA SERRA;EMBU-GUACU;1;902160;LORIS NASSIF MATTAR PROFA;8;0;0;0;100;0;0;100;0;0
2021;ITAPECERICA DA SERRA;EMBU-GUACU;1;904181;MARIO FRANCISCO DE AMORIM;8;0;0;0;99;0;1;98,1;0;1,9
2021;ITAPECERICA DA SERRA;EMBU-GUACU;1;904193;JOAO ORTIZ RODRIGUES;8;0;0;0;100;0;0;0;0;0
2021;ITAPECERICA DA SERRA;EMBU-GUACU;1;912402;FRANCISCO DE PAULA TEIXEIRA;8;100;0;0;0;0;0;0;0;0
2021;ITAPECERICA DA SERRA;EMBU-GUACU;1;914782;DONIZETTI APARECIDO LEITE PROFESSOR;8;0;0;0;100;0;0;99,8;0,2;0
2021;ITAPECERICA DA SERRA;EMBU-GUACU;1;914848;LEVI PEREIRA MARTINS PROFESSOR;8;100;0;0;100;0;0;100;0;0
2021;ITAPECERICA DA SERRA;EMBU-GUACU;1;917084;LUIZ SCHUNCK;8;100;0;0;0;0;0;0;0;0
2021;ITAPECERICA DA SERRA;EMBU-GUACU;1;918672;BAIRRO BOA VISTA;8;0;0;0;100;0;0;0;0;0
2021;ITAPECERICA DA SERRA;EMBU-GUACU;1;918817;NEIDE CELESTINA DE OLIVEIRA PROFA;8;0;0;0;100;0;0;0;0;0
2021;ITAPECERICA DA SERRA;EMBU-GUACU;1;918830;JARDIM CAMPESTRE;8;100;0;0;0;0;0;0;0;0
2021;ITAPECERICA DA SERRA;EMBU-GUACU;1;919007;CHACARA FLORIDA II;8;100;0;0;0;0;0;0;0;0
2021;ITAPECERICA DA SERRA;EMBU-GUACU;1;920058;JARDIM SILVANIA;8;100;0;0;0;0;0;0;0;0
2021;ITAPECERICA DA SERRA;ITAPECERICA DA SERRA;1;9945;CARLOS ALBERTO PEREIRA;8;0;0;0;100;0;0;0;0;0
2021;ITAPECERICA DA SERRA;ITAPECERICA DA SERRA;1;9957;PORCINO RODRIGUES PROF;8;0;0;0;100;0;0;99,83;0,17;0
2021;ITAPECERICA DA SERRA;ITAPECERICA DA SERRA;1;9970;ISABEL A REDENTORA;8;0;0;0;99,16;0,84;0;88,94;7,54;3,52
2021;ITAPECERICA DA SERRA;ITAPECERICA DA SERRA;1;9982;MATILDE MARIA CREMM;8;0;0;0;95,32;4,68;0;97,22;2,78;0
2021;ITAPECERICA DA SERRA;ITAPECERICA DA SERRA;1;9994;SEBASTIAO DE MORAES CARDOSO;8;0;0;0;100;0;0;100;0;0
2021;ITAPECERICA DA SERRA;ITAPECERICA DA SERRA;1;10005;JOAO BAPTISTA DE OLIVEIRA;8;0;0;0;100;0;0;99,44;0,56;0
2021;ITAPECERICA DA SERRA;ITAPECERICA DA SERRA;1;10029;ANGENOR DE OLIVEIRA POETA;8;0;0;0;100;0;0;95,16;0;4,84
2021;ITAPECERICA DA SERRA;ITAPECERICA DA SERRA;1;10327;JULIA DE CASTRO CARNEIRO;8;0;0;0;100;0;0;99,55;0,22;0,23
2021;ITAPECERICA DA SERRA;ITAPECERICA DA SERRA;1;35415;INSTITUTO MARIA IMACULADA;8;100;0;0;100;0;0;0;0;0
2021;ITAPECERICA DA SERRA;ITAPECERICA DA SERRA;1;35427;LUCIA AKEMI MIYA PROFA;8;0;0;0;100;0;0;100;0;0
2021;ITAPECERICA DA SERRA;ITAPECERICA DA SERRA;1;36407;JARDIM JACIRA;8;0;0;0;100;0;0;100;0;0
2021;ITAPECERICA DA SERRA;ITAPECERICA DA SERRA;1;37138;GERTRUDES EDER;8;0;0;0;100;0;0;100;0;0
2021;ITAPECERICA DA SERRA;ITAPECERICA DA SERRA;1;40721;SALVADOR DE LEONE;8;0;0;0;100;0;0;100;0;0
2021;ITAPECERICA DA SERRA;ITAPECERICA DA SERRA;1;40733;MASSAKO HIGASHIOKA PROFESSORA;8;0;0;0;100;0;0;100;0;0
2021;ITAPECERICA DA SERRA;ITAPECERICA DA SERRA;1;40745;EDUARDO ROBERTO DAHER;8;100;0;0;100;0;0;100;0;0
2021;ITAPECERICA DA SERRA;ITAPECERICA DA SERRA;1;40757;JOAQUIM FERNANDO PAES DE BARROS NETO;8;0;0;0;100;0;0;100;0;0
2021;ITAPECERICA DA SERRA;ITAPECERICA DA SERRA;1;44854;ANTONIO FLORENTINO;8;0;0;0;100;0;0;99,74;0;0,26
2021;ITAPECERICA DA SERRA;ITAPECERICA DA SERRA;1;46231;JOSE SILVEIRA DA MOTTA PROFESSOR;8;100;0;0;0;0;0;0;0;0
2021;ITAPECERICA DA SERRA;ITAPECERICA DA SERRA;1;49098;ABRAHAO DE MORAES PROFESSOR;8;0;0;0;100;0;0;100;0;0
2021;ITAPECERICA DA SERRA;ITAPECERICA DA SERRA;1;61591;JARDIM MONTESANO;8;0;0;0;99,5;0;0,5;94,48;0;5,52
2021;ITAPECERICA DA SERRA;ITAPECERICA DA SERRA;1;61608;JARDIM DO CARMO;8;0;0;0;100;0;0;0;0;0
2021;ITAPECERICA DA SERRA;ITAPECERICA DA SERRA;1;902135;BENEVIDES BERALDO COMENDADOR;8;0;0;0;100;0;0;100;0;0
2021;ITAPECERICA DA SERRA;ITAPECERICA DA SERRA;1;902159;MARIA OLIMPIA DE SOUZA QUEIROZ MACIEL;8;0;0;0;100;0;0;98,98;1,02;0
2021;ITAPECERICA DA SERRA;ITAPECERICA DA SERRA;1;903036;BAIRRO ITAQUACIARA;8;100;0;0;0;0;0;0;0;0
2021;ITAPECERICA DA SERRA;ITAPECERICA DA SERRA;1;906517;SOPHIA MARIA JANUARIA AMARAL;8;0;0;0;98,07;1,5;0,43;94,47;0;5,53
2021;ITAPECERICA DA SERRA;ITAPECERICA DA SERRA;1;914794;EURICO DA SILVA BASTOS DOUTOR PROFESSOR;8;100;0;0;0;0;0;0;0;0
2021;ITAPECERICA DA SERRA;ITAPECERICA DA SERRA;1;918659;ASA BRANCA DA SERRA;8;0;0;0;96,96;3,04;0;90,65;9,35;0
2021;ITAPECERICA DA SERRA;ITAPECERICA DA SERRA;1;923308;NATERCIA CREMM DE MORAES PEDRO PROFESSORA;8;0;0;0;100;0;0;100;0;0
2021;ITAPECERICA DA SERRA;ITAPECERICA DA SERRA;1;925597;ASDRUBAL DO NASCIMENTO QUEIROZ PROFESSOR;8;0;0;0;99,03;0,65;0,32;99,21;0,79;0
2021;ITAPECERICA DA SERRA;ITAPECERICA DA SERRA;1;925603;LEDA FELICE FERREIRA PROFESSORA;8;0;0;0;99,23;0;0,77;97,38;0;2,62
2021;ITAPECERICA DA SERRA;ITAPECERICA DA SERRA;1;925615;PAULO DE CASTRO FERREIRA JUNIOR JORNALISTA;8;0;0;0;100;0;0;98,68;0;1,32
2021;ITAPECERICA DA SERRA;JUQUITIBA;1;10157;OREDO RODRIGUES DA CRUZ;8;0;0;0;100;0;0;100;0;0
2021;ITAPECERICA DA SERRA;JUQUITIBA;1;36365;BAIRRO DOS BARNABES;8;0;0;0;100;0;0;99,41;0;0,59
2021;ITAPECERICA DA SERRA;JUQUITIBA;1;44891;BAIRRO DAS PALMEIRAS;8;0;0;0;100;0;0;100;0;0
2021;ITAPECERICA DA SERRA;JUQUITIBA;1;80548;BAIRRO DOS BARNABES RECANTO DAS ORQUIDEAS;8;100;0;0;0;0;0;0;0;0
2021;ITAPECERICA DA SERRA;JUQUITIBA;1;902184;BAIRRO DA PALMEIRINHA;8;100;0;0;100;0;0;100;0;0
2021;ITAPECERICA DA SERRA;JUQUITIBA;1;902196;JORGE NINO SOARES PROFESSOR;8;100;0;0;100;0;0;0;0;0
2021;ITAPECERICA DA SERRA;JUQUITIBA;1;903048;PEDRA BRANCA;8;100;0;0;100;0;0;100;0;0
2021;ITAPECERICA DA SERRA;JUQUITIBA;1;910569;BAIRRO NOSSA SENHORA DA CONCEICAO;8;100;0;0;100;0;0;0;0;0
2021;ITAPECERICA DA SERRA;JUQUITIBA;1;913424;ELIANA FISCHER BAMBI DELFINO PINTO PROFESSORA;8;100;0;0;100;0;0;100;0;0
2021;ITAPECERICA DA SERRA;JUQUITIBA;1;915282;BAIRRO VITALINO;8;100;0;0;0;0;0;0;0;0
2021;ITAPECERICA DA SERRA;SAO LOURENCO DA SERRA;1;10017;MARIANINHA QUEIROZ PROFESSORA;8;0;0;0;100;0;0;98,19;1,81;0
2021;ITAPECERICA DA SERRA;SAO LOURENCO DA SERRA;1;80615;ANDRE FRANCO MONTORO GOVERNADOR;8;0;0;0;100;0;0;100;0;0
2021;ITAPECERICA DA SERRA;SAO LOURENCO DA SERRA;1;910685;ANTONIO BALDUSCO PREFEITO;8;0;0;0;100;0;0;98,94;1,06;0
2021;ITAPEVI;BARUERI;1;9787;IVANI MARIA PAES PROFESSORA;8;0;0;0;0;0;0;99,01;0,99;0
2021;ITAPEVI;BARUERI;1;9799;CAIO PRADO JUNIOR DEPUTADO;8;0;0;0;0;0;0;97,39;0;2,61
2021;ITAPEVI;BARUERI;1;9830;REPUBLICA DO EQUADOR;8;0;0;0;0;0;0;96,47;3,53;0
2021;ITAPEVI;BARUERI;1;9878;ALAYDE DOMINGUES COUTO MACEDO PROFESSORA;8;0;0;0;0;0;0;92,54;1,11;6,35
2021;ITAPEVI;BARUERI;1;9891;JOSE WILSON PADINHA PROFESSOR;8;0;0;0;0;0;0;100;0;0
2021;ITAPEVI;BARUERI;1;9912;ALDEIA DE BARUERI;8;0;0;0;0;0;0;99,34;0;0,66
2021;ITAPEVI;BARUERI;1;9921;JOSE DOMINGOS DA SILVEIRA PROFESSOR;8;0;0;0;0;0;0;100;0;0
2021;ITAPEVI;BARUERI;1;35440;REPUBLICA DE CUBA;8;0;0;0;0;0;0;89,86;0,68;9,46
2021;ITAPEVI;BARUERI;1;36389;REPUBLICA DE EL SALVADOR;8;0;0;0;0;0;0;99,49;0,13;0,38
2021;ITAPEVI;BARUERI;1;40548;NESTOR DE CAMARGO PREFEITO;8;0;0;0;0;0;0;100;0;0
2021;ITAPEVI;BARUERI;1;40551;LENIO VIEIRA DE MORAES PROFESSOR;8;0;0;0;0;0;0;99,11;0,44;0,45
2021;ITAPEVI;BARUERI;1;44921;MYRTHES THEREZINHA ASSAD VILLELA PROFA;8;0;0;0;0;0;0;95,48;4,52;0
2021;ITAPEVI;BARUERI;1;44933;MARIO JOAQUIM ESCOBAR DE ANDRADE;8;0;0;0;0;0;0;87,52;12,48;0
2021;ITAPEVI;BARUERI;1;49025;JARDIM MARIA HELENA I;8;0;0;0;0;0;0;99,35;0,65;0
2021;ITAPEVI;BARUERI;1;290075;HENRIQUE FERNANDO GOMES ESTUDANTE;8;0;0;0;0;0;0;100;0;0
2021;ITAPEVI;BARUERI;1;908617;JARDIM PAULISTA;8;0;0;0;0;0;0;99,81;0;0,19
2021;ITAPEVI;BARUERI;1;908836;ITAJAHY FEITOSA MARTINS PROFESSOR;8;0;0;0;0;0;0;100;0;0
2021;ITAPEVI;BARUERI;1;910485;AMADOR AGUIAR;8;0;0;0;0;0;0;100;0;0
2021;ITAPEVI;BARUERI;1;918702;JOSE LEANDRO DE BARROS PIMENTEL;8;0;0;0;0;0;0;98,18;0;1,82
2021;ITAPEVI;BARUERI;1;918805;LEONOR MENDES DE BARROS;8;0;0;0;0;0;0;100;0;0
2021;ITAPEVI;BARUERI;1;920241;PARQUE IMPERIAL;8;0;0;0;0;0;0;100;0;0
2021;ITAPEVI;ITAPEVI;1;10388;JOSE CHALUPPE;8;0;0;0;97,18;0;2,82;93,68;0;6,32
2021;ITAPEVI;ITAPEVI;1;10424;CELINA DE BARROS BAIRAO PROFESSORA;8;0;0;0;100;0;0;99,36;0;0,64
2021;ITAPEVI;ITAPEVI;1;10431;AMERICO VALENTIN CHRISTIANINI;8;0;0;0;99,82;0;0,18;100;0;0
2021;ITAPEVI;ITAPEVI;1;10443;NACIF AMIN CHALUPE;8;0;0;0;99,39;0,31;0,3;100;0;0
2021;ITAPEVI;ITAPEVI;1;10467;RAUL BRIQUET DOUTOR;8;0;0;0;96,57;0;3,43;85,57;0;14,43
2021;ITAPEVI;ITAPEVI;1;10479;CLARO CAMARGO RIBEIRO;8;0;0;0;99,8;0,2;0;100;0;0
2021;ITAPEVI;ITAPEVI;1;10480;DIMARAES ANTONIO SANDEI PROFESSOR;8;0;0;0;100;0;0;100;0;0
2021;ITAPEVI;ITAPEVI;1;10613;CANDIDO RONDON MARECHAL;8;0;0;0;99,83;0,17;0;99,54;0,46;0
2021;ITAPEVI;ITAPEVI;1;10650;JOSE NEYDE CESAR LESSA DOUTOR;8;0;0;0;100;0;0;100;0;0
2021;ITAPEVI;ITAPEVI;1;43886;JOSE THEOTONIO DOS SANTOS PROFESSOR;8;0;0;0;100;0;0;100;0;0
2021;ITAPEVI;ITAPEVI;1;46607;JOAO NASCIF CHALUPP;8;0;0;0;97,72;1,3;0,98;94,5;5,18;0,32
2021;GUARATINGUETA;GUARATINGUETA;1;12919;ROGERIO LACAZ PROF;8;0;0;0;99,63;0,37;0;0;0;0
2021;GUARATINGUETA;GUARATINGUETA;1;12920;FRANCISCO AUGUSTO DA COSTA BRAGA PROF;8;0;0;0;0;0;0;99,73;0;0,27
2021;GUARATINGUETA;GUARATINGUETA;1;37175;LUIZ MENEZES PROF;8;0;0;0;88,02;11,98;0;78,72;21,28;0
2021;GUARATINGUETA;GUARATINGUETA;1;45378;DINAH MOTTA RUNHA PROFA;8;0;0;0;100;0;0;97,09;2,91;0
2021;GUARATINGUETA;GUARATINGUETA;1;905045;JOSE PEREIRA EBOLI PROF;8;0;0;0;100;0;0;98,67;1,33;0
2021;GUARATINGUETA;GUARATINGUETA;1;921725;SYLVIO JOSE MARCONDES COELHO PROF;8;0;0;0;100;0;0;100;0;0
2021;GUARATINGUETA;LAVRINHAS;1;12403;HORTA CORONEL;8;0;0;0;100;0;0;100;0;0
2021;GUARATINGUETA;LAVRINHAS;1;901489;JULIO FORTES;8;0;0;0;0;0;0;100;0;0
2021;GUARATINGUETA;LORENA;1;12944;GABRIEL PRESTES;8;0;0;0;0;0;0;100;0;0
2021;GUARATINGUETA;LORENA;1;12968;LUIZ DE CASTRO PINTO PROF;8;0;0;0;95,92;4,08;0;89;11;0
2021;GUARATINGUETA;LORENA;1;13109;ARNOLFO AZEVEDO;8;0;0;0;100;0;0;100;0;0
2021;GUARATINGUETA;LORENA;1;13110;JOAQUIM FERREIRA PEDRO PROF;8;0;0;0;99,26;0;0,74;0;0;0
2021;GUARATINGUETA;LORENA;1;13161;FRANCISCO MARQUES DE OLIVEIRA JUNIOR PROF;8;0;0;0;100;0;0;100;0;0
2021;GUARATINGUETA;LORENA;1;444340;CENTRO DE ATEND SOCIOEDUC AO ADOLESC LORENA - CI;34;100;0;0;100;0;0;100;0;0
2021;GUARATINGUETA;LORENA;1;901507;AROLDO AZEVEDO PROF;8;0;0;0;99,09;0,91;0;95,76;4,24;0
2021;GUARATINGUETA;LORENA;1;903127;MIQUELINA CARTOLANO PROFA;8;0;0;0;100;0;0;100;0;0
2021;GUARATINGUETA;LORENA;1;907200;REGINA BARTELEGA DA CUNHA M JUNQUEIRA ORTIZ MONTEIRO;8;0;0;0;100;0;0;0;0;0
2021;GUARATINGUETA;PIQUETE;1;13006;LEONOR GUIMARAES PROFA;8;0;0;0;98,35;1,65;0;95,93;4,07;0
2021;GUARATINGUETA;PIQUETE;1;13018;DARWIN FELIX PROF;8;0;0;0;97,98;2,02;0;97,59;1,2;1,21
2021;GUARATINGUETA;POTIM;1;12725;JOSE FELIX PROF;8;0;0;0;0;0;0;100;0;0
2021;GUARATINGUETA;QUELUZ;1;12427;JOSE DE PAULA FRANCA PROF;8;0;0;0;0;0;0;100;0;0
2021;GUARATINGUETA;ROSEIRA;1;12877;ANDRE BROCA PROF;8;0;0;0;0;0;0;86,64;13,36;0
2021;GUARATINGUETA;SAO JOSE DO BARREIRO;1;12440;MIGUEL PEREIRA;8;0;0;0;0;0;0;99,29;0;0,71
2021;GUARATINGUETA;SILVEIRAS;1;12555;HILDEBRANDO MARTINS SODERO PROF;8;0;0;0;99,6;0;0,4;99,48;0;0,52
2021;PINDAMONHANGABA;CAMPOS DO JORDAO;1;13286;THEODORO CORREA CINTRA PROFESSOR;8;0;0;0;0;0;0;97,41;2,59;0
2021;PINDAMONHANGABA;CAMPOS DO JORDAO;1;442550;EXPEDITO CAMARGO FREIRE PROFESSOR;8;0;0;0;0;0;0;98,26;1,74;0
2021;PINDAMONHANGABA;PINDAMONHANGABA;1;5930;BEM VIVER;8;0;0;0;100;0;0;0;0;0
2021;PINDAMONHANGABA;PINDAMONHANGABA;1;13183;JOAO PEDRO CARDOSO DR;8;0;0;0;0;0;0;94,76;5,24;0
2021;PINDAMONHANGABA;PINDAMONHANGABA;1;13195;JOAO MARTINS DE ALMEIDA PROFESSOR;8;0;0;0;100;0;0;0;0;0
2021;PINDAMONHANGABA;PINDAMONHANGABA;1;13201;PEDRO SILVA PROFESSOR;8;0;0;0;93,01;6,99;0;78,68;21,32;0
2021;PINDAMONHANGABA;PINDAMONHANGABA;1;13262;CLARO CESAR DEPUTADO;8;0;0;0;100;0;0;100;0;0
2021;PINDAMONHANGABA;PINDAMONHANGABA;1;13336;MARIO BULCAO GIUDICE PROFESSOR;8;0;0;0;96,89;3,11;0;92,93;7,07;0
2021;PINDAMONHANGABA;PINDAMONHANGABA;1;13353;ALZIRA FRANCO PROFESSORA;8;0;0;0;99,69;0,31;0;0;0;0
2021;PINDAMONHANGABA;PINDAMONHANGABA;1;13365;RYOITI YASSUDA;8;0;0;0;0;0;0;99,65;0,35;0
2021;PINDAMONHANGABA;PINDAMONHANGABA;1;13389;EURIPEDES BRAGA PROFESSOR;8;0;0;0;100;0;0;0;0;0
2021;PINDAMONHANGABA;PINDAMONHANGABA;1;13390;ALFREDO PUJOL DOUTOR;8;0;0;0;0;0;0;97,34;0;2,66
2021;PINDAMONHANGABA;PINDAMONHANGABA;1;13407;MARIO TAVARES DOUTOR;8;0;0;0;100;0;0;100;0;0
2021;PINDAMONHANGABA;PINDAMONHANGABA;1;13432;GABRIELLA MONTEIRO DE ATHAYDE MARCONDES PROFESSORA;8;0;0;0;97,65;2,35;0;94,23;5,77;0
2021;PINDAMONHANGABA;PINDAMONHANGABA;1;13444;JOAO JOSE DE AZEVEDO MONSENHOR;8;0;0;0;100;0;0;100;0;0
2021;PINDAMONHANGABA;PINDAMONHANGABA;1;13456;YOLANDA BUENO DE GODOY PROFESSORA;8;0;0;0;100;0;0;100;0;0
2021;PINDAMONHANGABA;PINDAMONHANGABA;1;37205;IOLANDA VELLUTINI PROFESSORA;8;0;0;0;100;0;0;0;0;0
2021;PINDAMONHANGABA;PINDAMONHANGABA;1;40836;YONNE CESAR GUAYCURU DE OLIVEIRA PROFESSORA;8;0;0;0;0;0;0;100;0;0
2021;PINDAMONHANGABA;PINDAMONHANGABA;1;42250;JOSE PINTO MARCONDES PESTANA PROFESSOR;8;0;0;0;0;0;0;98,67;0;1,33
2021;PINDAMONHANGABA;PINDAMONHANGABA;1;42274;WILSON PIRES CESAR PROFESSOR;8;0;0;0;100;0;0;0;0;0
2021;PINDAMONHANGABA;PINDAMONHANGABA;1;45408;ISMENIA MONTEIRO DE OLIVEIRA PROFESSORA;8;0;0;0;100;0;0;0;0;0
2021;PINDAMONHANGABA;PINDAMONHANGABA;1;46802;EUNICE BUENO ROMEIRO PROFESSORA;8;0;0;0;100;0;0;0;0;0
2021;PINDAMONHANGABA;PINDAMONHANGABA;1;48197;ALEXANDRINA GOMES DE ARAUJO RODRIGUES PROFESSORA;8;0;0;0;100;0;0;100;0;0
2021;PINDAMONHANGABA;PINDAMONHANGABA;1;49207;IVONE NOGUEIRA DE AZEVEDO PROFESSORA;8;0;0;0;100;0;0;0;0;0
2021;PINDAMONHANGABA;PINDAMONHANGABA;1;901519;DIRCE APARECIDA PEREIRA MARCONDES;8;0;0;0;100;0;0;0;0;0
2021;PINDAMONHANGABA;PINDAMONHANGABA;1;901520;RUBENS ZAMITH PROFESSOR;8;0;0;0;99,71;0,29;0;100;0;0
2021;PINDAMONHANGABA;PINDAMONHANGABA;1;908046;JOSE WADIE MILAD PROFESSOR;8;0;0;0;100;0;0;100;0;0
2021;PINDAMONHANGABA;PINDAMONHANGABA;1;908058;ANTONIA CARLOTA GOMES PROFESSORA;8;0;0;0;99,75;0,25;0;0;0;0
2021;PINDAMONHANGABA;PINDAMONHANGABA;1;914435;CELIA KEIKO IKEDA PROFESSORA;8;0;0;0;99,17;0,83;0;0;0;0
2021;PINDAMONHANGABA;PINDAMONHANGABA;1;916262;ELOYNA SALGADO RIBEIRO PROFESSORA;8;0;0;0;100;0;0;100;0;0
2021;PINDAMONHANGABA;PINDAMONHANGABA;1;916286;ESCOLASTICA ANTUNES SALGADO PROFESSORA;8;0;0;0;100;0;0;92,38;3,81;3,81
2021;PINDAMONHANGABA;PINDAMONHANGABA;1;916651;ISIS CASTRO DE MELLO CESAR PROFA;8;0;0;0;100;0;0;0;0;0
