ANO_LETIVO;NM_DIRETORIA;NM_MUNICIPIO;CD_REDE_ENSINO;CD_ESCOLA;NM_COMPLETO_ESCOLA;CD_TP_IDENTIFICADOR;APR_1;REP_1;ABA_1;APR_2;REP_2;ABA_2;APR_3;REP_3;ABA_3
2021;CAMPINAS LESTE;CAMPINAS;1;478830;CENTRO ATEND SOCIOED AO ADOLESC CAMPINAS UN II CI;34;0;0;0;100;0;0;85,71;0;14,29
2021;CAMPINAS LESTE;CAMPINAS;1;563146;ADRIANA CARDOSO PROFESSORA ;8;100;0;0;100;0;0;0;0;0
2021;CAMPINAS LESTE;CAMPINAS;1;564990;BERNARDO CARO;8;100;0;0;100;0;0;100;0;0
2021;CAMPINAS LESTE;CAMPINAS;1;901088;ALBERTO MEDALJON PROFESSOR;8;100;0;0;95,21;4,79;0;96,84;3,16;0
2021;CAMPINAS LESTE;CAMPINAS;1;903875;MOACYR SANTOS DE CAMPOS PROFESSOR;8;0;0;0;100;0;0;99,79;0;0,21
2021;CAMPINAS LESTE;CAMPINAS;1;903887;WASHINGTON JOSE DE LACERDA ORTIZ PROFESSOR;8;100;0;0;0;0;0;0;0;0
2021;CAMPINAS LESTE;CAMPINAS;1;903905;ALBERTO MARTINS PROFESSOR;8;100;0;0;0;0;0;0;0;0
2021;CAMPINAS LESTE;CAMPINAS;1;905458;JULIA LUIZ RUETE;8;99,7;0,3;0;0;0;0;0;0;0
2021;CAMPINAS LESTE;CAMPINAS;1;907364;MARIA ALICE COLEVATI RODRIGUES PROFESSORA;8;100;0;0;0;0;0;0;0;0
2021;CAMPINAS LESTE;CAMPINAS;1;907418;HUMBERTO DE CAMPOS INSTITUTO POPULAR;8;100;0;0;0;0;0;0;0;0
2021;CAMPINAS LESTE;CAMPINAS;1;912924;EUNICE VIRGINIA RAMOS NAVERO PROFESSORA;8;100;0;0;100;0;0;0;0;0
2021;CAMPINAS LESTE;CAMPINAS;1;914873;UACURY RIBEIRO DE ASSIS BASTOS PROFESSOR;8;100;0;0;100;0;0;0;0;0
2021;CAMPINAS LESTE;CAMPINAS;1;914885;SERGIO PEREIRA PORTO FISICO ;8;99,45;0,55;0;0;0;0;0;0;0
2021;CAMPINAS LESTE;CAMPINAS;1;920502;LUIZ GONZAGA HORTA LISBOA PROFESSOR;8;100;0;0;100;0;0;0;0;0
2021;CAMPINAS LESTE;CAMPINAS;1;922420;ADIWALDE DE OLIVEIRA COELHO PROFESSOR;8;100;0;0;0;0;0;0;0;0
2021;CAMPINAS LESTE;JAGUARIUNA;1;17700;CELSO HENRIQUE TOZZI PROFESSOR;8;0;0;0;0;0;0;99,74;0,26;0
2021;CAMPINAS LESTE;JAGUARIUNA;1;47053;JULIA CALHAU RODRIGUES PROFESSORA;8;0;0;0;0;0;0;99,29;0,43;0,28
2021;CAMPINAS LESTE;JAGUARIUNA;1;913996;ANNA CALVO DE GODOY PROFESSORA;8;0;0;0;0;0;0;91,25;8,75;0
2021;CAPIVARI;CAPIVARI;1;20795;MARIA JANUARIA VAZ TUCCORI PROFESSORA;8;0;0;0;100;0;0;98,34;0;1,66
2021;CAPIVARI;CAPIVARI;1;20801;FABIANO JOSE MOREIRA CAMARGO PADRE;8;0;0;0;97,99;0;2,01;97,59;0;2,41
2021;CAPIVARI;CAPIVARI;1;580120;WALDEMAR THOMAZINE;8;0;0;0;99,37;0;0,63;97,69;0;2,31
2021;CAPIVARI;CAPIVARI;1;901167;JOSE BONIFACIO CARRETTA PADRE;8;0;0;0;99,47;0;0,53;100;0;0
2021;CAPIVARI;ELIAS FAUSTO;1;20941;MASCARENHAS DE MORAES GENERAL;8;0;0;0;0;0;0;97,95;0;2,05
2021;CAPIVARI;ELIAS FAUSTO;1;20953;GENNY PIMAZZONI PROFESSORA;8;0;0;0;0;0;0;100;0;0
2021;CAPIVARI;INDAIATUBA;1;18624;JOAQUIM PEDROSO DE ALVARENGA;8;0;0;0;99,2;0,8;0;98,62;1,38;0
2021;CAPIVARI;INDAIATUBA;1;18659;GERALDO ENEAS DE CAMPOS PROFESSOR;8;0;0;0;99,8;0,2;0;0;0;0
2021;CAPIVARI;INDAIATUBA;1;18661;HELENA DE CAMPOS CAMARGO PROFESSORA;8;0;0;0;100;0;0;99,78;0;0,22
2021;CAPIVARI;INDAIATUBA;1;18673;JOSE DE CAMARGO BARROS DOM;8;0;0;0;97,35;0;2,65;87,69;1,13;11,18
2021;CAPIVARI;INDAIATUBA;1;18843;HELIO CERQUEIRA LEITE PROFESSOR;8;0;0;0;100;0;0;100;0;0
2021;CAPIVARI;INDAIATUBA;1;18909;RANDOLFO MOREIRA FERNANDES;8;0;0;0;98,35;0;1,65;99,67;0;0,33
2021;CAPIVARI;INDAIATUBA;1;45724;SAO NICOLAU DE FLUE;8;0;0;0;100;0;0;100;0;0
2021;CAPIVARI;INDAIATUBA;1;47788;ANTONIO DE PADUA PRADO PROFESSOR;8;0;0;0;95,34;0;4,66;84;0;16
2021;CAPIVARI;INDAIATUBA;1;49463;CAMILO MARQUES PAULA PROFESSOR DOUTOR;8;0;0;0;100;0;0;100;0;0
2021;CAPIVARI;INDAIATUBA;1;49475;MARIA APPARECIDA PINTO DA CUNHA PROFESSORA;8;0;0;0;100;0;0;98,13;1,88;-0,01
2021;CAPIVARI;INDAIATUBA;1;446567;JARDIM MORADA DO SOL;8;0;0;0;100;0;0;99,12;0;0,88
2021;CAPIVARI;INDAIATUBA;1;462378;SUELY MARIA CACAO AMBIEL BATISTA PROFESSORA;8;0;0;0;0;0;0;100;0;0
2021;CAPIVARI;INDAIATUBA;1;496601;PROFESSORA MARIA BERNADETE AMGARTEN PERES;8;0;0;0;100;0;0;98,9;1,1;0
2021;CAPIVARI;INDAIATUBA;1;903929;MILTON LEME DO PRADO PROFESSOR;8;0;0;0;96,72;3,07;0,21;89,14;7,57;3,29
2021;CAPIVARI;INDAIATUBA;1;907424;AURORA SCODRO GROFF;8;0;0;0;100;0;0;100;0;0
2021;CAPIVARI;INDAIATUBA;1;909403;MARIA DE LOURDES STIPP STEFFEN PROFESSORA;8;0;0;0;99,26;0,74;0;98,4;1,6;0
2021;CAPIVARI;INDAIATUBA;1;909415;CARLOS TANCLER PROFESSOR;8;0;0;0;99,24;0;0,76;96,94;0;3,06
2021;CAPIVARI;INDAIATUBA;1;909427;SUZANA BENEDICTA GIGO AYRES PROFESSORA;8;0;0;0;100;0;0;100;0;0
2021;CAPIVARI;INDAIATUBA;1;913972;DEOLINDA MANEIRA SEVERO PROFESSORA;8;0;0;0;99,33;0,67;0;97,76;2,24;0
2021;CAPIVARI;INDAIATUBA;1;920083;ANNUNZIATTA LEONILDA VIRGINELLI PRADO PROFESSORA;8;0;0;0;99,87;0;0,13;100;0;0
2021;CAPIVARI;INDAIATUBA;1;920666;JOSE DE CAMPOS PROFESSOR;8;0;0;0;100;0;0;0;0;0
2021;CAPIVARI;MOMBUCA;1;21124;MATEUS BISPO DOM;8;0;0;0;0;0;0;100;0;0
2021;CAPIVARI;MONTE MOR;1;18727;ELIAS MASSUD DOUTOR;8;0;0;0;100;0;0;98,51;0;1,49
2021;CAPIVARI;MONTE MOR;1;406272;MARIO COVAS GOVERNADOR;8;0;0;0;99,58;0;0,42;98,27;0;1,73
2021;CAPIVARI;MONTE MOR;1;903930;LAURINDO GOMES CARNEIRO CORONEL;8;0;0;0;0;0;0;95,83;0,6;3,57
2021;CAPIVARI;MONTE MOR;1;913017;CARMELA CHIARA GINEFRA PROFESSORA;8;0;0;0;0;0;0;98,48;1,52;0
2021;CAPIVARI;MONTE MOR;1;914009;JOANA DE AGUIRRE MARINS PEIXOTO PROFESSORA;8;0;0;0;97,64;0;2,36;98,01;0;1,99
2021;CAPIVARI;MONTE MOR;1;917783;ANTONIO SPROESSER PROFESSOR;8;0;0;0;0;0;0;90,62;0;9,38
2021;CAPIVARI;MONTE MOR;1;920678;CYRIACO SCARANELLO PIRES CONEGO;8;0;0;0;98,68;0;1,32;97,72;0;2,28
2021;CAPIVARI;RAFARD;1;21118;JENI APPRILANTE PROFESSORA;8;0;0;0;100;0;0;99,42;0;0,58
2021;CAPIVARI;RIO DAS PEDRAS;1;21155;MANOEL DA COSTA NEVES PROFESSOR;8;0;0;0;0;0;0;99,34;0;0,66
2021;CAPIVARI;RIO DAS PEDRAS;1;905604;MARIA JOSE DE AGUIAR ZEPPELINI PROFESSORA;8;0;0;0;100;0;0;100;0;0
2021;ARARAQUARA;AMERICO BRASILIENSE;1;21830;DINORA MARCONDES GOMES PROFA;8;0;0;0;100;0;0;100;0;0
2021;ARARAQUARA;AMERICO BRASILIENSE;1;42778;ALZIRA DIAS DE TOLEDO PIZA PROFA;8;0;0;0;100;0;0;99,47;0;0,53
2021;ARARAQUARA;AMERICO BRASILIENSE;1;907704;ALBERTO ALVES ROLLO DR;8;0;0;0;100;0;0;100;0;0
2021;ARARAQUARA;ARARAQUARA;1;4092;PROFA MIRYAN LEOPOLDINA CARAMURU DE CASTRO MONTEIRO;8;0;0;0;100;0;0;98,55;1,45;0
2021;ARARAQUARA;ARARAQUARA;1;4714;VEREADOR CARLOS ROBERTO MARQUES;8;0;0;0;100;0;0;100;0;0
2021;ARARAQUARA;ARARAQUARA;1;21854;BENTO DE ABREU;8;0;0;0;100;0;0;100;0;0
2021;ARARAQUARA;ARARAQUARA;1;21885;ANTONIA EUGENIA MARTINS PROFA;8;100;0;0;0;0;0;0;0;0
2021;ARARAQUARA;ARARAQUARA;1;21891;GERALDO HONORATO AZZI SACHS PROF;8;100;0;0;0;0;0;0;0;0
2021;ARARAQUARA;ARARAQUARA;1;21933;NARCISO DA SILVA CESAR;8;100;0;0;0;0;0;0;0;0
2021;ARARAQUARA;ARARAQUARA;1;21945;JOAO PIRES DE CAMARGO DR;8;0;0;0;100;0;0;100;0;0
2021;ARARAQUARA;ARARAQUARA;1;21957;AUGUSTO DA SILVA CESAR PROF;8;0;0;0;99,46;0,54;0;92,26;6,55;1,19
2021;ARARAQUARA;ARARAQUARA;1;21969;FLORESTANO LIBUTTI;8;100;0;0;0;0;0;0;0;0
2021;ARARAQUARA;ARARAQUARA;1;21970;VICTOR LACORTE PROF;8;0;0;0;100;0;0;100;0;0
2021;ARARAQUARA;ARARAQUARA;1;21994;DORIVAL ALVES;8;0;0;0;100;0;0;100;0;0
2021;ARARAQUARA;ARARAQUARA;1;22020;ANTONIO JOAQUIM DE CARVALHO;8;100;0;0;0;0;0;0;0;0
2021;ARARAQUARA;ARARAQUARA;1;22068;PEDRO JOSE NETO;8;0;0;0;0;0;0;100;0;0
2021;ARARAQUARA;ARARAQUARA;1;22073;JOAO MANOEL DO AMARAL;8;0;0;0;100;0;0;100;0;0
2021;ARARAQUARA;ARARAQUARA;1;22081;FRANCISCO PEDRO MONTEIRO DA SILVA;8;100;0;0;0;0;0;0;0;0
2021;ARARAQUARA;ARARAQUARA;1;22123;LETICIA DE GODOY BUENO DE CARVALHO LOPES PROFA;8;0;0;0;100;0;0;100;0;0
2021;ARARAQUARA;ARARAQUARA;1;22147;LEA DE FREITAS MONTEIRO PROFA;8;0;0;0;100;0;0;100;0;0
2021;ARARAQUARA;ARARAQUARA;1;22159;ANTONIO LOURENCO CORREA;8;100;0;0;0;0;0;0;0;0
2021;ARARAQUARA;ARARAQUARA;1;22160;JOAO BATISTA DE OLIVEIRA;8;0;0;0;100;0;0;100;0;0
2021;ARARAQUARA;ARARAQUARA;1;38982;ANTONIO DOS SANTOS PROF;8;0;0;0;100;0;0;100;0;0
2021;ARARAQUARA;ARARAQUARA;1;43540;LUISA ROLFSEN PETRILLI PROFA;8;100;0;0;0;0;0;0;0;0
2021;ARARAQUARA;ARARAQUARA;1;46085;ERGILIA MICELLI PROFA;8;0;0;0;100;0;0;100;0;0
2021;ARARAQUARA;ARARAQUARA;1;47405;LYSANIAS DE OLIVEIRA CAMPOS PROF;8;0;0;0;100;0;0;100;0;0
2021;ARARAQUARA;ARARAQUARA;1;435697;MARIA ISABEL RODRIGUES ORSO PROFA;8;0;0;0;100;0;0;100;0;0
2021;ARARAQUARA;ARARAQUARA;1;462330;JOAQUIM PINTO MACHADO JUNIOR PROFESSOR MACHADINHO;8;0;0;0;0;0;0;100;0;0
2021;ARARAQUARA;ARARAQUARA;1;462536;OACYR ANTONIO ELLERO PROFESSOR;8;0;0;0;100;0;0;100;0;0
2021;ARARAQUARA;ARARAQUARA;1;479342;URIAS BRAGA COSTA PROFESSOR;8;0;0;0;100;0;0;0;0;0
2021;ARARAQUARA;ARARAQUARA;1;559489;CENTRO ATEND SOCIOEDUC AO ADOLESCENTE DE ARARAQUARA CI;34;75;25;0;0;0;0;0;0;0
2021;ARARAQUARA;ARARAQUARA;1;559490;CENTRO ATEND SOCIOEDUC AO ADOLESCENTE DE ARARAQUARA CI;34;0;0;0;100;0;0;100;0;0
2021;ARARAQUARA;ARARAQUARA;1;903334;ANTONIO DE OLIVEIRA BUENO FILHO;8;100;0;0;0;0;0;0;0;0
2021;ARARAQUARA;ARARAQUARA;1;903358;LEONARDO BARBIERI DEPUTADO;8;100;0;0;99,64;0,36;0;0;0;0
2021;ARARAQUARA;ARARAQUARA;1;907728;JANDYRA NERY GATTI PROFA;8;100;0;0;0;0;0;0;0;0
2021;ARARAQUARA;ARARAQUARA;1;914265;ANGELINA LIA ROLFSEN PROFA;8;0;0;0;100;0;0;100;0;0
2021;ARARAQUARA;ARARAQUARA;1;922973;SERGIO PEDRO SPERANZA PROF;8;100;0;0;100;0;0;100;0;0
2021;ARARAQUARA;BOA ESPERANCA DO SUL;1;21829;MARCELINO BRAGA CEL;8;0;0;0;0;0;0;100;0;0
2021;ARARAQUARA;GAVIAO PEIXOTO;1;21908;GAVIAO PEIXOTO CONSELHEIRO;8;0;0;0;0;0;0;100;0;0
2021;ARARAQUARA;MATAO;1;24934;JOSE INOCENCIO DA COSTA;8;0;0;0;100;0;0;100;0;0
2021;ARARAQUARA;MATAO;1;24946;HENRIQUE MORATO PROF;8;0;0;0;0;0;0;100;0;0
2021;ARARAQUARA;MATAO;1;24958;CHLORITA DE OLIVEIRA PENTEADO MARTINS PROFA;8;0;0;0;100;0;0;100;0;0
2021;ARARAQUARA;MATAO;1;24961;LEOPOLDINO MEIRA DE ANDRADE DR;8;100;0;0;100;0;0;0;0;0
2021;ARARAQUARA;MATAO;1;24971;NELSON ANTONIO ROMAO PADRE;8;100;0;0;0;0;0;0;0;0
2021;ARARAQUARA;MATAO;1;25008;ROBERTO VELTRE PROF;8;100;0;0;0;0;0;0;0;0
2021;ARARAQUARA;MATAO;1;25148;HELENA BORSETTI PROFA;8;0;0;0;0;0;0;100;0;0
2021;ARARAQUARA;MATAO;1;44672;LAERT JOSE TARALLO MENDES PROF;8;100;0;0;0;0;0;0;0;0
2021;ARARAQUARA;MATAO;1;47909;ODONE BELLINE PROF;8;0;0;0;100;0;0;100;0;0
2021;ARARAQUARA;MATAO;1;49633;DORIVAL DE CARVALHO;8;0;0;0;100;0;0;0;0;0
2021;ARARAQUARA;MATAO;1;497381;JARDIM BUSCARDI;8;0;0;0;0;0;0;99,56;0,44;0
2021;ARARAQUARA;MATAO;1;903536;ADERVAL DA SILVA PROF;8;100;0;0;0;0;0;0;0;0
2021;ARARAQUARA;MATAO;1;905756;JOAO SALGADO SOBRINHO DEPUTADO;8;100;0;0;0;0;0;0;0;0
2021;ARARAQUARA;MATAO;1;909695;JOSE CARLOS PINOTTI;8;0;0;0;100;0;0;0;0;0
2021;ARARAQUARA;MATAO;1;911896;GUERINO VEDOATO;8;100;0;0;0;0;0;0;0;0
2021;ARARAQUARA;MATAO;1;919408;ERNESTO MASSELANI;8;100;0;0;0;0;0;0;0;0
2021;ARARAQUARA;MATAO;1;919412;MARLENE FRATTINI PROFA;8;0;0;0;100;0;0;0;0;0
2021;ARARAQUARA;MOTUCA;1;22135;ADOLPHO THOMAS DE AQUINO;8;0;0;0;0;0;0;100;0;0
2021;ARARAQUARA;NOVA EUROPA;1;21912;LUZIA DE ABREU PROFA;8;0;0;0;0;0;0;100;0;0
2021;ARARAQUARA;RINCAO;1;21878;PEDRO MORGANTI COMENDADOR;8;0;0;0;88,19;2,89;8,92;79,22;9,09;11,69
2021;ARARAQUARA;SANTA LUCIA;1;21866;BENTO DE ABREU;8;0;0;0;100;0;0;99,6;0;0,4
2021;ARARAQUARA;TRABIJU;1;21921;ALFREDO EVANGELISTA NOGUEIRA;8;0;0;0;0;0;0;100;0;0
2021;BARRETOS;ALTAIR;1;28228;OVIDIO DE SOUZA DIAS;8;0;0;0;100;0;0;100;0;0
2021;BARRETOS;BARRETOS;1;22214;BENEDITO PEREIRA CARDOSO PROFESSOR;8;0;0;0;100;0;0;100;0;0
2021;BARRETOS;BARRETOS;1;22263;ALMEIDA PINTO;8;0;0;0;100;0;0;100;0;0
2021;BARRETOS;BARRETOS;1;22329;PAULINA NUNES DE MORAES PROFESSORA;8;0;0;0;100;0;0;100;0;0
2021;BARRETOS;BARRETOS;1;22354;MARIO VIEIRA MARCONDES;8;0;0;0;100;0;0;100;0;0
2021;BARRETOS;BARRETOS;1;22391;SILVESTRE DE LIMA CORONEL;8;0;0;0;100;0;0;100;0;0
2021;BARRETOS;BARRETOS;1;22445;AYMORE DO BRASIL PROFESSOR;8;0;0;0;100;0;0;0;0;0
2021;BARRETOS;BARRETOS;1;22457;MACEDO SOARES EMBAIXADOR;8;0;0;0;100;0;0;100;0;0
2021;BARRETOS;BARRETOS;1;22469;ANTONIO OLYMPIO DOUTOR;8;0;0;0;100;0;0;100;0;0
2021;BARRETOS;BARRETOS;1;36894;VALOIS SCORTECCI;8;0;0;0;100;0;0;0;0;0
2021;BARRETOS;BARRETOS;1;579889;MARIA HELENA SCANNAVINO;8;0;0;0;0;0;0;100;0;0
2021;BARRETOS;BARRETOS;1;907736;FABIO JUNQUEIRA FRANCO;8;0;0;0;100;0;0;100;0;0
2021;BARRETOS;BARRETOS;1;907741;LACY BONILHA DE SOUZA PROFESSORA;8;0;0;0;100;0;0;100;0;0
2021;BARRETOS;COLINA;1;48012;DARCY SILVEIRA VAZ PROFESSOR;8;0;0;0;0;0;0;100;0;0
2021;BARRETOS;COLOMBIA;1;22342;ALICE FONTOURA DE ARAUJO DONA;8;0;0;0;0;0;0;100;0;0
2021;BARRETOS;GUAIRA;1;22238;ENOCH GARCIA LEAL;8;0;0;0;100;0;0;100;0;0
2021;BARRETOS;GUAIRA;1;22421;DALVA LELLIS GARCIA PRADO PROFA;8;0;0;0;100;0;0;100;0;0
2021;BARRETOS;GUAIRA;1;22433;ZEZINHO PORTUGAL;8;0;0;0;100;0;0;100;0;0
2021;BARRETOS;GUARACI;1;28095;JOSE ANTONIO SANTANA;8;0;0;0;0;0;0;100;0;0
2021;BARRETOS;JABORANDI;1;22287;ALEXANDRE DE AVILA BORGES;8;0;0;0;0;0;0;99,37;0;0,63
2021;BARRETOS;OLIMPIA;1;28022;NARCISO BERTOLINO CAPITAO;8;0;0;0;100;0;0;0;0;0
2021;BARRETOS;OLIMPIA;1;28034;ANITA COSTA DONA;8;0;0;0;100;0;0;100;0;0
2021;BARRETOS;OLIMPIA;1;28046;WILQUEM MANOEL NEVES DOUTOR;8;0;0;0;100;0;0;100;0;0
2021;BARRETOS;OLIMPIA;1;28061;MARIA UBALDINA DE BARROS FURQUIM PROFESSORA;8;0;0;0;100;0;0;100;0;0
2021;BARRETOS;OLIMPIA;1;28071;ANTONIO AUGUSTO REIS NEVES DOUTOR;8;0;0;0;100;0;0;100;0;0
2021;BARRETOS;OLIMPIA;1;28113;FRANCISCO BERNARDES FERREIRA COMENDADOR;8;0;0;0;100;0;0;100;0;0
2021;BARRETOS;OLIMPIA;1;28125;ELOI LOPES FERRAZ DOUTOR;8;0;0;0;100;0;0;100;0;0
2021;BARRETOS;OLIMPIA;1;49712;DALVA VIEIRA ITAVO PROFESSORA;8;0;0;0;100;0;0;100;0;0
2021;BARRETOS;OLIMPIA;1;919664;ALZIRA TONELLI ZACCARELLI PROFESSORA;8;0;0;0;100;0;0;0;0;0
2021;BARRETOS;SEVERINIA;1;28137;JOSE MARCELINO DE ALMEIDA;8;0;0;0;0;0;0;97,76;2,02;0,22
2021;FRANCA;CRISTAIS PAULISTA;1;22861;JOAO DE FARIA;8;0;0;0;0;0;0;99,63;0,37;0
2021;FRANCA;FRANCA;1;22779;CAETANO PETRAGLIA;8;100;0;0;0;0;0;0;0;0
2021;FRANCA;FRANCA;1;22780;AMALIA PIMENTEL PROFA;8;100;0;0;0;0;0;0;0;0
2021;FRANCA;FRANCA;1;22792;JOAO MARCIANO DE ALMEIDA DR;8;0;0;0;100;0;0;100;0;0
2021;FRANCA;FRANCA;1;22809;OTAVIO MARTINS DE SOUZA PROF;8;0;0;0;100;0;0;100;0;0
2021;FRANCA;FRANCA;1;22822;CARMEM MUNHOZ COELHO PROFA;8;0;0;0;100;0;0;100;0;0
2021;FRANCA;FRANCA;1;22834;SUZANA RIBEIRO SANDOVAL PROFA;8;98,77;0,98;0,25;0;0;0;0;0;0
2021;FRANCA;FRANCA;1;22846;ANA MARIA JUNQUEIRA PROFA;8;0;0;0;98,86;1,14;0;98,25;1,75;0
2021;FRANCA;FRANCA;1;22858;JOSE DOS REIS MIRANDA FILHO PROFESSOR;8;100;0;0;0;0;0;0;0;0
2021;FRANCA;FRANCA;1;22871;ORLIK LUZ DR;8;0;0;0;99,21;0,79;0;100;0;0
2021;FRANCA;FRANCA;1;22895;FRANCISCO MARTINS CORONEL;8;100;0;0;0;0;0;0;0;0
2021;FRANCA;FRANCA;1;22913;ANGELO SCARABUCCI;8;0;0;0;100;0;0;100;0;0
2021;FRANCA;FRANCA;1;22937;DAVID CARNEIRO EWBANK;8;0;0;0;100;0;0;99,89;0,11;0
2021;FRANCA;FRANCA;1;22950;DANTE GUEDINE FILHO PROF;8;0;0;0;99,64;0;0,36;0;0;0
2021;FRANCA;FRANCA;1;22986;HOMERO ALVES;8;0;0;0;100;0;0;0;0;0
2021;FRANCA;FRANCA;1;23115;BARAO DE FRANCA;8;100;0;0;0;0;0;0;0;0
2021;FRANCA;FRANCA;1;23127;TORQUATO CALEIRO;8;0;0;0;97,28;2,45;0,27;96,11;3,89;0
2021;FRANCA;FRANCA;1;23176;MARIO D ELIA;8;0;0;0;99,8;0;0,2;100;0;0
2021;FRANCA;FRANCA;1;23206;JERONIMO BARBOSA SANDOVAL;8;0;0;0;100;0;0;0;0;0
2021;FRANCA;FRANCA;1;36870;ANGELO GOSUEN PROF;8;0;0;0;100;0;0;94,92;0;5,08
2021;FRANCA;FRANCA;1;36882;LINA PICCHIONI ROCHA PROFA;8;99,56;0,44;0;0;0;0;0;0;0
2021;FRANCA;FRANCA;1;39007;PEDRO NUNES ROCHA PROF;8;0;0;0;98,37;0;1,63;97,26;0;2,74
2021;FRANCA;FRANCA;1;42808;IOLANDA RIBEIRO NOVAIS PROFA;8;100;0;0;0;0;0;0;0;0
2021;FRANCA;FRANCA;1;46152;ANTONIO FACHADA PROF;8;0;0;0;98,55;0;1,45;97,26;0;2,74
2021;FRANCA;FRANCA;1;47454;HELIO PALERMO PROF;8;0;0;0;99,49;0;0,51;94,78;0;5,22
2021;FRANCA;FRANCA;1;48586;JOSEPHINA ZINNI ALMADA PROFA;8;100;0;0;0;0;0;0;0;0
2021;FRANCA;FRANCA;1;49980;JULIO CESAR D ELIA PROF;8;100;0;0;99,14;0;0,86;95;1,43;3,57
2021;FRANCA;FRANCA;1;65997;HELENA CURY DE TACCA PROFA;8;0;0;0;98,39;0,4;1,21;95,28;1,11;3,61
2021;FRANCA;FRANCA;1;66000;LUIZ PARIDE SINELLI PROF;8;0;0;0;97,63;0;2,37;88,37;0;11,63
2021;FRANCA;FRANCA;1;70002;AGOSTINHO LIMA DE VILHENA PROF;8;0;0;0;100;0;0;94,04;5,33;0,63
2021;FRANCA;FRANCA;1;70038;MARIA CINTRA NUNES ROCHA PROFA DONA BRANCA;8;0;0;0;100;0;0;100;0;0
2021;FRANCA;FRANCA;1;344746;CENTRO ATEND SOCIO-EDUC AO ADOLESC DE FRANCA - CI;34;0;0;0;93,33;6,67;0;100;0;0
2021;FRANCA;FRANCA;1;351076;VICENTE MINICUCCI PROFESSOR;8;0;0;0;99,55;0,45;0;99,41;0,59;0
2021;FRANCA;FRANCA;1;442318;MARIA DO CARMO SILVA FERREIRA PROFA - DONA NENZINHA;8;0;0;0;99,74;0;0,26;99;0;1
2021;FRANCA;FRANCA;1;442324;ODETTE BUENO RIBEIRO PROFESSORA;8;0;0;0;100;0;0;99,53;0,47;0
2021;FRANCA;FRANCA;1;496534;ASSUERO QUADRI PRESTES DR PROFESSOR;8;0;0;0;100;0;0;100;0;0
2021;FRANCA;FRANCA;1;496546;ROBERTO SCARABUCI PROFESSOR;8;0;0;0;99,33;0;0,67;97,48;0;2,52
2021;FRANCA;FRANCA;1;496558;ADELMO FRANCISCO DA SILVA;8;0;0;0;100;0;0;100;0;0
2021;FRANCA;FRANCA;1;497253;STELLA DA MATTA AMBROSIO PROFESSORA;8;0;0;0;98,57;1,43;0;99,55;0,45;0
2021;FRANCA;FRANCA;1;900655;JOSE PINHEIRO DE LACERDA CAPITAO;8;0;0;0;96,64;3,36;0;94,85;4,04;1,11
2021;FRANCA;FRANCA;1;900667;SUDARIO FERREIRA;8;0;0;0;100;0;0;100;0;0
2021;FRANCA;FRANCA;1;900679;SUELY MACHADO DA SILVA PROFA;8;0;0;0;100;0;0;100;0;0
2021;ANDRADINA;PEREIRA BARRETO;1;30570;MITSUSADA UMETANI DR;8;0;0;0;100;0;0;100;0;0
2021;ANDRADINA;PEREIRA BARRETO;1;30703;AGNES LIEDTKE;8;0;0;0;100;0;0;0;0;0
2021;ANDRADINA;PEREIRA BARRETO;1;30764;FRANCISCO SCHMIDT CEL;8;0;0;0;0;0;0;100;0;0
2021;ANDRADINA;SUD MENNUCCI;1;30673;CICERO CASTILHO CUNHA;8;0;0;0;0;0;0;100;0;0
2021;ARACATUBA;ARACATUBA;1;29713;LUIZ GAMA;8;0;0;0;100;0;0;100;0;0
2021;ARACATUBA;ARACATUBA;1;29737;LICOLINA VILLELA REIS ALVES PROFA;8;0;0;0;100;0;0;100;0;0
2021;ARACATUBA;ARACATUBA;1;29749;CLOVIS DE ARRUDA CAMPOS DR;8;0;0;0;100;0;0;100;0;0
2021;ARACATUBA;ARACATUBA;1;29762;NILCE MAIA SOUTO MELO PROFA;8;0;0;0;98,12;1,88;0;99,63;0,37;0
2021;ARACATUBA;ARACATUBA;1;29774;JOSE AUGUSTO LOPES BORGES PROF;8;0;0;0;100;0;0;100;0;0
2021;ARACATUBA;ARACATUBA;1;29798;MANOEL BENTO DA CRUZ;8;0;0;0;100;0;0;99,86;0,14;0
2021;ARACATUBA;ARACATUBA;1;29804;VITOR ANTONIO TRINDADE PROF;8;0;0;0;100;0;0;99,66;0,34;0
2021;ARACATUBA;ARACATUBA;1;29865;JOSE CANDIDO;8;0;0;0;99,84;0;0,16;0;0;0
2021;ARACATUBA;ARACATUBA;1;29877;PURCINA ELISA DE ALMEIDA PROFA;8;0;0;0;98,5;0;1,5;100;0;0
2021;ARACATUBA;ARACATUBA;1;29889;JORGE CORREA PROF;8;0;0;0;100;0;0;100;0;0
2021;ARACATUBA;ARACATUBA;1;29890;GENESIO DE ASSIS PROF;8;0;0;0;100;0;0;100;0;0
2021;ARACATUBA;ARACATUBA;1;30016;VANIOLE DIONYSIO MARQUES PAVAN PROFA;8;0;0;0;99,68;0,32;0;100;0;0
2021;ARACATUBA;ARACATUBA;1;30053;MARIA APPARECIDA BALTHAZAR POCO PROFA;8;0;0;0;100;0;0;100;0;0
2021;ARACATUBA;ARACATUBA;1;30065;JOSE ARANTES TERRA PROF;8;0;0;0;100;0;0;100;0;0
2021;ARACATUBA;ARACATUBA;1;30089;JOUBERT DE CARVALHO DR;8;0;0;0;100;0;0;0;0;0
2021;ARACATUBA;ARACATUBA;1;47612;SILVESTRE AUGUSTO DO NASCIMENTO;8;0;0;0;100;0;0;100;0;0
2021;ARACATUBA;ARACATUBA;1;48513;ALTINA MORAES SAMPAIO PROFA;8;0;0;0;100;0;0;0;0;0
2021;ARACATUBA;ARACATUBA;1;297689;CENTRO ATEND SOCIO-EDUC AO ADOLESCENTE - ARACATUBA-CI;34;0;0;0;100;0;0;100;0;0
2021;ARACATUBA;ARACATUBA;1;559301;CENTRO ATEND SOCIO-EDUC ADOLESCENTE - ARACA - CI;34;0;0;0;95,45;4,55;0;96,67;3,33;0
2021;ARACATUBA;ARACATUBA;1;559957;CENTRO ATEND SOCIO-EDUC ADOLESC - ARACA - CI;34;100;0;0;0;0;0;0;0;0
2021;ARACATUBA;ARACATUBA;1;907224;ABRANCHE JOSE PROF;8;0;0;0;100;0;0;100;0;0
2021;ARACATUBA;ARACATUBA;1;907236;MARIA DO CARMO LELIS PROFA;8;0;0;0;100;0;0;100;0;0
2021;ARACATUBA;ARACATUBA;1;909257;ARTHUR LEITE CARRIJO PROF;8;0;0;0;100;0;0;100;0;0
2021;ARACATUBA;ARACATUBA;1;920575;CONJUNTO HABITACIONAL EZEQUIEL BARBOSA;8;0;0;0;100;0;0;100;0;0
2021;ARACATUBA;ARACATUBA;1;924611;ARY BOCUHY PROF;8;0;0;0;100;0;0;100;0;0
2021;ARACATUBA;BENTO DE ABREU;1;29993;OLIMPIO CAMARGO PROF;8;0;0;0;100;0;0;100;0;0
2021;ARACATUBA;GUARARAPES;1;29944;JOAO ARRUDA BRASIL;8;0;0;0;100;0;0;100;0;0
2021;ARACATUBA;GUARARAPES;1;30041;WALDEMAR QUEIROZ PROF;8;0;0;0;100;0;0;100;0;0
2021;ARACATUBA;GUARARAPES;1;907248;AIMONE SALA PROF;8;0;0;0;100;0;0;100;0;0
2021;ARACATUBA;RUBIACEA;1;30004;FRANCISCO PRUDENTE CORREA CORONEL;8;0;0;0;100;0;0;98,84;0;1,16
2021;ARACATUBA;SANTO ANTONIO DO ARACANGUA;1;29816;JOAO BATISTA BOTELHO;8;0;0;0;0;0;0;100;0;0
2021;ARACATUBA;SANTO ANTONIO DO ARACANGUA;1;29836;LIDIA PERRI BARBOSA PROFA;8;0;0;0;0;0;0;100;0;0
2021;ARACATUBA;VALPARAISO;1;29973;ARLINDA PESSOA MORBECK;8;0;0;0;100;0;0;100;0;0
2021;ARACATUBA;VALPARAISO;1;29981;VICENTE BARBOSA;8;0;0;0;100;0;0;100;0;0
2021;ARACATUBA;VALPARAISO;1;498087;DAVID GOLIAS PROF;8;0;0;0;100;0;0;0;0;0
2021;BIRIGUI;BILAC;1;30235;ENZO BRUNO CARRAMASCHI PROFESSOR;8;0;0;0;100;0;0;100;0;0
2021;BIRIGUI;BIRIGUI;1;30119;STELIO MACHADO LOUREIRO PROFESSOR;8;0;0;0;100;0;0;100;0;0
2021;BIRIGUI;BIRIGUI;1;30120;CARLOS ROSA DOUTOR;8;0;0;0;100;0;0;0;0;0
2021;BIRIGUI;BIRIGUI;1;30259;VICENTE FELICIO PRIMO;8;0;0;0;100;0;0;0;0;0
2021;BIRIGUI;BIRIGUI;1;30272;REGINA VALARINI VIEIRA PROFA;8;0;0;0;98,94;0;1,06;96,56;3,15;0,29
2021;BIRIGUI;BIRIGUI;1;43102;LYDIA HELENA FRANDSEN STUHR PROFESSORA;8;0;0;0;100;0;0;100;0;0
2021;BIRIGUI;BIRIGUI;1;48562;IZABEL DE ALMEIDA MARIN PROFESSORA;8;0;0;0;100;0;0;100;0;0
2021;BIRIGUI;BIRIGUI;1;446981;TEREZINHA LOT ZIN TELECO PROFESSORA;8;0;0;0;97,22;2,78;0;93,97;6,03;0
2021;BIRIGUI;BIRIGUI;1;905926;RICARDO PERUZZO PROFESSOR;8;0;0;0;100;0;0;99,18;0,82;0
2021;BIRIGUI;BIRIGUI;1;905938;HERMINIO CANTISANI PROFESSOR;8;0;0;0;100;0;0;100;0;0
2021;BIRIGUI;BIRIGUI;1;913856;ESMERALDA MILANO MARONI PROFESSORA;8;0;0;0;100;0;0;100;0;0
2021;BIRIGUI;BIRIGUI;1;917643;GERACINA DE MENEZES SANCHES PROFESSORA;8;0;0;0;99,46;0,54;0;98,58;1,42;0
2021;BIRIGUI;BIRIGUI;1;923382;ANTONIO SALES OLIVEIRA PROFESSOR;8;0;0;0;99,68;0,32;0;100;0;0
2021;BIRIGUI;BIRIGUI;1;924283;OLIVIA ANGELA FURLANI PROFESSORA;8;0;0;0;100;0;0;99,55;0,45;0
2021;BIRIGUI;BREJO ALEGRE;1;30107;AGOSTINHO GRIGOLETO;8;0;0;0;100;0;0;100;0;0
2021;BIRIGUI;BURITAMA;1;30132;ALVARO ALVIM;8;0;0;0;100;0;0;100;0;0
2021;BIRIGUI;BURITAMA;1;30173;OSWALDO JANUZZI PROFESSOR;8;0;0;0;100;0;0;100;0;0
2021;BIRIGUI;COROADOS;1;30260;JOSE MARIA DOS REIS DOUTOR;8;0;0;0;100;0;0;98,54;1,46;0
2021;BIRIGUI;GABRIEL MONTEIRO;1;30211;ANTONIO KASSAWARA KATUTOK;8;0;0;0;100;0;0;100;0;0
2021;BIRIGUI;GLICERIO;1;30181;MARIA MATHILDE CASTEIN CASTILHO PROFESSORA;8;0;0;0;100;0;0;99,13;0,87;0
2021;BIRIGUI;LOURDES;1;30193;PIO ANTUNES DE FIGUEIREDO DOUTOR;8;0;0;0;100;0;0;100;0;0
2021;BIRIGUI;PIACATU;1;30508;CINELZIA LORENCI MARONI PROFESSORA;8;0;0;0;100;0;0;100;0;0
2021;BIRIGUI;TURIUBA;1;30247;OCTAVIANO CARDOSO;8;0;0;0;100;0;0;100;0;0
2021;PENAPOLIS;ALTO ALEGRE;1;30326;DIOGO GARCIA MARTINS EXPEDICIONARIO;8;0;0;0;100;0;0;100;0;0
2021;PENAPOLIS;AVANHANDAVA;1;30348;MARIA EUNICE MARTINS FERREIRA PROFESSORA;8;0;0;0;99,63;0,37;0;96,91;3,09;0
2021;PENAPOLIS;BARBOSA;1;30387;JOSE CARLOS DA SILVA PROFESSOR;8;0;0;0;100;0;0;100;0;0
2021;PENAPOLIS;BRAUNA;1;30512;JOSE FLORENTINO DE SOUZA;8;0;0;0;100;0;0;100;0;0
2021;PENAPOLIS;BRAUNA;1;395365;INDIA MARIA ROSA;10;100;0;0;85,71;14,29;0;0;0;0
2021;PENAPOLIS;CLEMENTINA;1;30521;MARIA DE FATIMA GOMES ALVES;8;0;0;0;100;0;0;100;0;0
2021;PENAPOLIS;LUIZIANIA;1;30478;FRANCISCO ANTONINO PREFEITO;8;0;0;0;100;0;0;100;0;0
2021;PENAPOLIS;PENAPOLIS;1;30296;LUIZ CHRISOSTOMO DE OLIVEIRA;8;100;0;0;0;0;0;0;0;0
2021;PENAPOLIS;PENAPOLIS;1;30314;CARLOS SAMPAIO FILHO DOUTOR;8;0;0;0;100;0;0;100;0;0
2021;PENAPOLIS;PENAPOLIS;1;30363;YONE DIAS DE AGUIAR PROFESSORA;8;0;0;0;100;0;0;100;0;0
2021;PENAPOLIS;PENAPOLIS;1;30442;ADELINO PETERS;8;0;0;0;100;0;0;100;0;0
2021;PENAPOLIS;PENAPOLIS;1;30466;AUGUSTO PEREIRA DE MORAES;8;100;0;0;0;0;0;0;0;0
2021;PENAPOLIS;PENAPOLIS;1;43114;ESTER EUNICE ALMEIDA FARIA DE OLIVEIRA PROFESSORA;8;0;0;0;100;0;0;99,55;0,45;0
2021;PENAPOLIS;PENAPOLIS;1;578009;PROFESSOR JOAO TEIXEIRA SAMPAIO;8;0;0;0;100;0;0;100;0;0
2021;PENAPOLIS;PENAPOLIS;1;913868;LUIZA MARIA BERNARDES NORY PROFESSORA;8;0;0;0;97,61;2,39;0;97,58;2,42;0
2021;PENAPOLIS;PENAPOLIS;1;919111;JOANA HELENA DE CASTILHO MARQUES PROFESSORA;8;0;0;0;99,39;0;0,61;98,29;0,43;1,28
2021;PENAPOLIS;SANTOPOLIS DO AGUAPEI;1;30454;MANOEL BENTO NETO;8;0;0;0;100;0;0;100;0;0
2021;ADAMANTINA;ADAMANTINA;1;30806;HELEN KELLER;8;0;0;0;100;0;0;100;0;0
2021;ADAMANTINA;ADAMANTINA;1;31045;DURVALINO GRION PROF;8;0;0;0;100;0;0;100;0;0
2021;ADAMANTINA;ADAMANTINA;1;31112;FLEURIDES CAVALLINI MENECHINO PROFA;8;0;0;0;100;0;0;99,61;0;0,39
2021;ADAMANTINA;DRACENA;1;31252;JULIETA GUEDES MENDONCA PROFA;8;0;0;0;100;0;0;100;0;0
2021;ADAMANTINA;DRACENA;1;31264;9 DE JULHO;8;0;0;0;100;0;0;100;0;0
2021;ADAMANTINA;DRACENA;1;31276;ISAC PEREIRA GARCEZ ENG;8;0;0;0;100;0;0;100;0;0
2021;ADAMANTINA;DRACENA;1;911173;ALFREDO MACHADO;8;0;0;0;100;0;0;100;0;0
2021;ADAMANTINA;FLORA RICA;1;30995;GUILHERME BUZINARO PREFEITO;8;0;0;0;0;0;0;100;0;0
2021;ADAMANTINA;FLORIDA PAULISTA;1;30910;PERCIO GOMES GONZALES DR;8;0;0;0;100;0;0;100;0;0
2021;ADAMANTINA;INUBIA PAULISTA;1;31598;IRALDO ANTONIO MARTINS DE TOLEDO;8;0;0;0;100;0;0;98,63;1,37;0
2021;ADAMANTINA;IRAPURU;1;30958;JOSE EDSON MOYSES PROF;8;0;0;0;97,55;2,45;0;95,07;4,93;0
2021;ADAMANTINA;IRAPURU;1;354570;CENTRO DE ATENDIMENTO SOC EDUC AO ADOLESC IRAPURU II CI;34;75;25;0;88,89;11,11;0;90;10;0
2021;ADAMANTINA;IRAPURU;1;448370;CENTRO DE ATENDIMENTO SOC EDUC AO ADOLES IRAPURU I - CI;34;0;0;0;88,89;11,11;0;100;0;0
2021;ADAMANTINA;JUNQUEIROPOLIS;1;31306;GERALDO PECORARI PROF;8;0;0;0;100;0;0;0;0;0
2021;ADAMANTINA;JUNQUEIROPOLIS;1;31525;IDENE RODRIGUES DOS SANTOS PROF;8;0;0;0;99,69;0,31;0;99,62;0,38;0
2021;ADAMANTINA;LUCELIA;1;30788;JOSE FIRPO;8;0;0;0;100;0;0;100;0;0
2021;ADAMANTINA;LUCELIA;1;578915;PROFESSOR CARLOS UMBERTO CARRARA;8;0;0;0;100;0;0;100;0;0
2021;ADAMANTINA;MARIAPOLIS;1;30892;ELMOZA ANTONIO JOAO PROFA;8;0;0;0;100;0;0;100;0;0
2021;ADAMANTINA;MONTE CASTELO;1;31471;JOAO BERNARDI;8;0;0;0;100;0;0;100;0;0
2021;ADAMANTINA;NOVA GUATAPORANGA;1;31422;JACINTO PERNAS GOMATO;8;0;0;0;100;0;0;98,36;1,64;0
2021;ADAMANTINA;OSVALDO CRUZ;1;31574;BENJAMIN CONSTANT;8;0;0;0;100;0;0;100;0;0
2021;ADAMANTINA;OSVALDO CRUZ;1;31616;OSVALDO MARTINS;8;0;0;0;100;0;0;100;0;0
2021;ADAMANTINA;OSVALDO CRUZ;1;31636;DOM BOSCO;8;0;0;0;100;0;0;100;0;0
2021;ADAMANTINA;OSVALDO CRUZ;1;922584;MARIA APARECIDA LOPES PROFA;8;0;0;0;100;0;0;99,12;0,88;0
2021;ADAMANTINA;OURO VERDE;1;31446;FERDINANDO IENNY;8;0;0;0;0;0;0;100;0;0
2021;ADAMANTINA;PACAEMBU;1;31069;JOEL AGUIAR PROF;8;0;0;0;99,74;0,26;0;97,73;2,27;0
2021;ADAMANTINA;PANORAMA;1;31159;LUCIO ANTUNES DOM;8;0;0;0;100;0;0;100;0;0
2021;ADAMANTINA;PANORAMA;1;31458;JOAO BRASIO;8;0;0;0;100;0;0;100;0;0
2021;ADAMANTINA;PAULICEIA;1;31355;ORLANDO GUIRADO BRAGA PROF;8;0;0;0;96,38;3,62;0;89,13;10,87;0
